{
  "$schema": "https://json-schema.org/draft/2020-12/schema",
  "$id": "amicode:handoff-seeds/hypothesis-seed.schema.json",
  "title": "Hypothesis handoff seed (dev closes → research picks up)",
  "description": "Typed cross-campaign currency for a code-side observation that deserves an experiment. Rendered to the vault hypothesis-card convention by the committed hypothesis-seed template; filed by the receiving side into the vault. Evidence pointers are vault-relative paths that must resolve at validation time. String fields are single-line so the template render is total.",
  "type": "object",
  "properties": {
    "kind": {
      "const": "hypothesis",
      "description": "Fixed discriminator; bound mechanically to this field set (the masquerade test)."
    },
    "observation": { "type": "string", "minLength": 1, "pattern": "^[^\\n\\r]*$" },
    "evidence": {
      "type": "array",
      "minItems": 1,
      "uniqueItems": true,
      "items": { "type": "string", "minLength": 1, "pattern": "^[^\\n\\r]*$" }
    },
    "suggested_experiment": { "type": "string", "minLength": 1, "pattern": "^[^\\n\\r]*$" }
  },
  "required": ["kind", "observation", "evidence", "suggested_experiment"],
  "additionalProperties": false
}
